{
  "ability_status_transitions": [
    {
      "after_state": "受伤后无法继续行动并接受治疗",
      "attribution": "R1A-2A source review of the cited legacy evidence",
      "background_ref": null,
      "before_state": "能够继续追击",
      "event_ref": "EVENT_P2_010_SEWER_SEARCH_AND_PREPARATION",
      "evidence_mode": "explicit_source_statement",
      "notes": "R1A-2A reviewed atomic realization; no present state or future conduct is inferred.",
      "persistence": "unknown",
      "reality_status": "ACTUAL_EVENT",
      "source_refs": [
        "extracted-second/NO.901MurginMunalos，我重临世界之日，诸逆臣皆当死去！ - 页 7/posts.md:469-478",
        "extracted-second/NO.901MurginMunalos，我重临世界之日，诸逆臣皆当死去！ - 页 8/posts.md:86-89"
      ],
      "story_order": "P2-010",
      "transition_id": "TRANSITION_CLAIM_NOSURI_TRAP_INJURY_EVENT_P2_010_SEWER_SEARCH_AND_PREPARATION",
      "transition_type": "injury",
      "uncertainty": "confirmed"
    }
  ],
  "ai_permissions": {
    "may_assign_new_goals": false,
    "may_choose_voluntary_actions": true,
    "may_describe_external_effects": true,
    "may_describe_involuntary_physical_reactions": true,
    "may_generate_dialogue": true,
    "may_generate_private_thoughts": true,
    "may_reference_established_history": true,
    "may_summarize_user_declared_actions": false
  },
  "aliases": [],
  "biographical_background": [],
  "campaign_timeline": [
    {
      "character_consequence": "",
      "character_specific_summary": "角色以“participant”参与；艾利等人围绕宅邸、诱饵与战术资源主动设局，准备截击古雷姆林。",
      "event_ref": "EVENT_P2_004_BAIT_PLAN_PREPARATION",
      "evidence_refs": [
        "extracted-second/NO.901MurginMunalos，我重临世界之日，诸逆臣皆当死去！ - 页 4/posts.jsonl post 868902",
        "extracted-second/NO.901MurginMunalos，我重临世界之日，诸逆臣皆当死去！ - 页 4/posts.jsonl post 895388",
        "extracted-second/NO.901MurginMunalos，我重临世界之日，诸逆臣皆当死去！ - 页 4/posts.jsonl post 900474"
      ],
      "notes": "Exact-reference R2B link reviewed in R2C.",
      "profile_canon_layer": "original_campaign",
      "reality_status": "ACTUAL_EVENT",
      "revelation_refs": [],
      "role_in_event": "participant",
      "story_order_end": null,
      "story_order_start": "P2-004",
      "timeline_id": "TIMELINE_NOSURI_P2_004_BAIT_PLAN_PREPARATION",
      "uncertainty": "confirmed"
    },
    {
      "character_consequence": "",
      "character_specific_summary": "角色以“combatant”参与；御临风在宅邸战中斩断古雷姆林脚筋并临阵悟出正十七；艾利、黄泉、诺斯莉加入围攻，但古雷姆林挟持艾利、制造魔偶后逃脱。御临风在追击失败后死亡。",
      "event_ref": "EVENT_P2_005_GREMLIN_MANSION_BATTLE",
      "evidence_refs": [
        "extracted-second/NO.901MurginMunalos，我重临世界之日，诸逆臣皆当死去！ - 页 5/posts.jsonl post 902068",
        "extracted-second/NO.901MurginMunalos，我重临世界之日，诸逆臣皆当死去！ - 页 5/posts.jsonl post 908892",
        "extracted-second/NO.901MurginMunalos，我重临世界之日，诸逆臣皆当死去！ - 页 5/posts.jsonl post 913039",
        "extracted-second/NO.901MurginMunalos，我重临世界之日，诸逆臣皆当死去！ - 页 5/posts.jsonl post 913595"
      ],
      "notes": "Exact-reference R2B link reviewed in R2C.",
      "profile_canon_layer": "original_campaign",
      "reality_status": "ACTUAL_EVENT",
      "revelation_refs": [],
      "role_in_event": "combatant",
      "story_order_end": null,
      "story_order_start": "P2-005",
      "timeline_id": "TIMELINE_NOSURI_P2_005_GREMLIN_MANSION_BATTLE",
      "uncertainty": "confirmed"
    },
    {
      "character_consequence": "艾利由外部支援转为队伍同行者。；御临风把保护悠悠落实为装备准备，并再次把此事与贞子遗憾相连。；悠悠取得托尔金提供的出行装备。；下水道追查失败，相关目标位置仍未知。",
      "character_specific_summary": "间接但人物连续性关键：下水道追查无果后艾利加入后续行动；御临风请求托尔金为悠悠准备装备，并在雪翁提醒下再次面对贞子遗憾与保护悠悠的动机。",
      "event_ref": "EVENT_P2_010_SEWER_SEARCH_AND_PREPARATION",
      "evidence_refs": [
        "extracted-second/NO.901MurginMunalos，我重临世界之日，诸逆臣皆当死去！ - 页 8/posts.jsonl post 917739",
        "extracted-second/NO.901MurginMunalos，我重临世界之日，诸逆臣皆当死去！ - 页 8/posts.jsonl post 919205",
        "extracted-second/NO.901MurginMunalos，我重临世界之日，诸逆臣皆当死去！ - 页 8/posts.jsonl post 920942",
        "extracted-second/NO.901MurginMunalos，我重临世界之日，诸逆臣皆当死去！ - 页 8/posts.jsonl post 921071"
      ],
      "notes": "Indirect continuity inclusion.",
      "profile_canon_layer": "original_campaign",
      "reality_status": "ACTUAL_EVENT",
      "revelation_refs": [],
      "role_in_event": "indirect continuity subject",
      "story_order_end": null,
      "story_order_start": "P2-010",
      "timeline_id": "TIMELINE_NOSURI_P2_010_SEWER_SEARCH_AND_PREPARATION",
      "uncertainty": "confirmed"
    }
  ],
  "canon_layers": [
    "original_campaign"
  ],
  "control_mode": "npc_runtime",
  "dynamic_state": {
    "as_of": "D3",
    "current_concerns": [],
    "current_conditions": [],
    "current_faction_role": null,
    "current_location_ref": null,
    "current_obligations": [],
    "notes": "没有以历史资料推断 D3 角色专属状态。",
    "source_refs": []
  },
  "evidence_gaps": [
    "稳定人格、价值排序与跨情境声线证据不足。",
    "D3 精确位置、即时议程与当前目标未知。"
  ],
  "goals": {
    "current_goals": [],
    "historical_goals": [],
    "long_term_goals": [],
    "private_goals": []
  },
  "id": "NPC_NOSURI",
  "identity": {
    "durable_affiliations": [],
    "durable_roles": [],
    "public_identity": [],
    "species_or_entity": []
  },
  "knowledge_timeline": [],
  "name": "诺斯莉",
  "nonactual_projections": [],
  "notes": "Existing effective profile migrated provisionally; not approved or applied.",
  "persona": {
    "core_personality": [],
    "decision_patterns": [],
    "motivations": [],
    "speech_style": [],
    "values": []
  },
  "phase": "3D-R2C",
  "presence": {
    "canon_layers": [
      "original_campaign"
    ],
    "life_status": "unknown",
    "narrative_availability": "inactive",
    "notes": "Profile depth does not force scene presence; inactive, restricted, historical, and interlude boundaries remain operative.",
    "source_refs": [
      "extracted-second/NO.901MurginMunalos，我重临世界之日，诸逆臣皆当死去！ - 页 4/posts.md:诺斯莉参与诱饵与围捕计划（lines 11-38, 147-220）"
    ],
    "uncertainty": "uncertain"
  },
  "profile_depth": "compact",
  "profile_kind": "npc",
  "profile_status": "existing",
  "provenance": {
    "generated_by": "scripts/build_phase3d_r2c.py",
    "migration_package": "work/phase3d_r2c/migration_packages/NPC_NOSURI.json",
    "source_origin_ids": [
      "work/phase3d_recall/repaired_candidates/NPC_NOSURI.json",
      "work/phase3d_r2b/indexes/by_profile/NPC_NOSURI.json",
      "work/phase3d_r2/chronology/campaign_chronology.jsonl",
      "work/phase3d_r2/chronology/character_revelations.jsonl",
      "work/phase3d_r2/event_audits/",
      "work/phase3d_r2/reports/early_arc_character_retention.md",
      "work/phase3d_r2/character_discoveries/",
      "current_state.md:D3",
      "output/worldbook_source.jsonl"
    ],
    "source_profile_candidate": "work/phase3d_recall/repaired_candidates/NPC_NOSURI.json"
  },
  "relationships": [
    {
      "current_stance": null,
      "notes": "欧基无需独立 Worldbook entry；这里只保留诺斯莉的明确姐弟关系，不推断当前立场。",
      "related_character_label": "CHARACTER_OUGI",
      "related_character_ref": null,
      "relationship_baseline": "siblings",
      "relationship_id": "RELATIONSHIP_NOSURI_OUGI",
      "relationship_milestones": [],
      "source_refs": [
        "extracted-second/NO.901MurginMunalos，我重临世界之日，诸逆臣皆当死去！ - 页 3/posts.md:388-398",
        "extracted-second/NO.901MurginMunalos，我重临世界之日，诸逆臣皆当死去！ - 页 4/posts.md:11-38"
      ],
      "uncertainty": "uncertain"
    },
    {
      "current_stance": null,
      "notes": "Historical/durable baseline only; no current emotion, loyalty, obligation, or future choice is inferred.",
      "related_character_label": null,
      "related_character_ref": "NPC_OUGI",
      "relationship_baseline": "欧基称诺斯莉为姐姐。",
      "relationship_id": "RELATIONSHIP_NPC_OUGI_CLAIM_NOSURI_IDENTITY_NPC_OUGI",
      "relationship_milestones": [],
      "source_refs": [
        "extracted-second/NO.901MurginMunalos，我重临世界之日，诸逆臣皆当死去！ - 页 4/posts.md:诺斯莉参与诱饵与围捕计划（lines 11-38, 147-220）"
      ],
      "uncertainty": "confirmed"
    },
    {
      "current_stance": null,
      "notes": "Historical/durable baseline only; no current emotion, loyalty, obligation, or future choice is inferred.",
      "related_character_label": null,
      "related_character_ref": "NPC_OUGI",
      "relationship_baseline": "诺斯莉是欧基所称的姐姐。",
      "relationship_id": "RELATIONSHIP_NPC_OUGI_CLAIM_NOSURI_OUGI_SIBLING_NPC_OUGI",
      "relationship_milestones": [],
      "source_refs": [
        "extracted-second/NO.901MurginMunalos，我重临世界之日，诸逆臣皆当死去！ - 页 3/posts.md:388-398",
        "extracted-second/NO.901MurginMunalos，我重临世界之日，诸逆臣皆当死去！ - 页 4/posts.md:11-38"
      ],
      "uncertainty": "confirmed"
    }
  ],
  "rp_constraints": [
    {
      "constraint_id": "CONSTRAINT_NOSURI_EVIDENCE_BOUNDARY",
      "notes": "Construction safety boundary; not a new world fact.",
      "source_refs": [
        "work/phase3c/evidence/NPC_NOSURI_evidence.md"
      ],
      "statement": "不得以单次行为、职业、能力或身份推断稳定人格、私人动机、未来目标或场景必然出席。"
    }
  ],
  "schema_version": "2.0",
  "worldbook_id": "CHARACTER_NOSURI",
  "worldbook_mapping_status": "existing"
}
