{
  "schema_version": "2.0", "phase": "3D-R2C", "id": "NPC_YOUYOU", "profile_kind": "npc",
  "profile_status": "existing", "worldbook_id": "CHARACTER_YOUYOU", "worldbook_mapping_status": "existing",
  "name": "悠悠", "aliases": [], "profile_depth": "full", "canon_layers": ["original_campaign", "transition"],
  "control_mode": "npc_runtime",
  "ai_permissions": {"may_generate_dialogue": true, "may_choose_voluntary_actions": true, "may_generate_private_thoughts": true, "may_assign_new_goals": false, "may_describe_external_effects": true, "may_describe_involuntary_physical_reactions": true, "may_summarize_user_declared_actions": false, "may_reference_established_history": true},
  "identity": {"public_identity": [], "species_or_entity": [], "durable_roles": [], "durable_affiliations": []},
  "biographical_background": [],
  "persona": {"core_personality": [], "values": [], "speech_style": [], "decision_patterns": [], "motivations": []},
  "goals": {"historical_goals": [], "current_goals": [], "long_term_goals": [], "private_goals": []},
  "campaign_timeline": [
    {"timeline_id": "TIMELINE_YOUYOU_CURSE", "event_ref": "EVENT_P1_017_IMPERIAL_AUDIENCE_CURSE_EXAMINATION", "story_order_start": "P1-017", "story_order_end": null, "profile_canon_layer": "original_campaign", "role_in_event": "诅咒审议对象", "character_specific_summary": "悠悠的诅咒与风险进入帝国高层审议。", "character_consequence": "诅咒状态被确认。", "revelation_refs": [], "evidence_refs": ["work/phase3d_r2/chronology/campaign_chronology.jsonl#EVENT_P1_017_IMPERIAL_AUDIENCE_CURSE_EXAMINATION"], "reality_status": "ACTUAL_EVENT", "uncertainty": "confirmed", "notes": ""},
    {"timeline_id": "TIMELINE_YOUYOU_TRANSFER", "event_ref": "EVENT_P1_021_JERGAL_TRANSFER", "story_order_start": "P1-021", "story_order_end": null, "profile_canon_layer": "original_campaign", "role_in_event": "诅咒转出者", "character_specific_summary": "诅咒从悠悠转入御临风。", "character_consequence": "悠悠获得新生。", "revelation_refs": [], "evidence_refs": ["work/phase3d_r2/chronology/campaign_chronology.jsonl#EVENT_P1_021_JERGAL_TRANSFER"], "reality_status": "ACTUAL_EVENT", "uncertainty": "confirmed", "notes": ""},
    {"timeline_id": "TIMELINE_YOUYOU_SURVIVAL", "event_ref": "EVENT_P2_001_CURSE_AND_CLINIC_OPENING", "story_order_start": "P2-001", "story_order_end": null, "profile_canon_layer": "original_campaign", "role_in_event": "转移后生还者", "character_specific_summary": "第二部开场确认诅咒转移后的持续生还。", "character_consequence": "生还连续性得到后续事件支持。", "revelation_refs": [], "evidence_refs": ["work/phase3d_r2/chronology/campaign_chronology.jsonl#EVENT_P2_001_CURSE_AND_CLINIC_OPENING"], "reality_status": "ACTUAL_EVENT", "uncertainty": "confirmed", "notes": ""},
    {"timeline_id": "TIMELINE_YOUYOU_INHERITANCE", "event_ref": "EVENT_P2_021_DRAGON_RITUAL_AND_ASSASSINATION", "story_order_start": "P2-021", "story_order_end": null, "profile_canon_layer": "original_campaign", "role_in_event": "空间龙族族长与仪式中心", "character_specific_summary": "悠悠以空间龙族族长身份处于典礼中心。", "character_consequence": "身份与仪式连续性确立。", "revelation_refs": [], "evidence_refs": ["work/phase3d_r2/chronology/campaign_chronology.jsonl#EVENT_P2_021_DRAGON_RITUAL_AND_ASSASSINATION"], "reality_status": "ACTUAL_EVENT", "uncertainty": "confirmed", "notes": "姓名继承的精确来源另保留。"},
    {"timeline_id": "TIMELINE_YOUYOU_PROPHECY_SEAL", "event_ref": "EVENT_P3_003_TEIRESIAS_REVELATION", "story_order_start": "P3-003", "story_order_end": null, "profile_canon_layer": "original_campaign", "role_in_event": "预言与最后力量的承接者", "character_specific_summary": "悠悠获得泰蕾斯最后力量并接触秘境毁灭等预见。", "character_consequence": "预言知识进入角色时间线。", "revelation_refs": [], "evidence_refs": ["work/phase3d_r2/chronology/campaign_chronology.jsonl#EVENT_P3_003_TEIRESIAS_REVELATION"], "reality_status": "PROPHECY", "uncertainty": "uncertain", "notes": "预言不自动等同实际事件。"},
    {"timeline_id": "TIMELINE_YOUYOU_PROTECTION", "event_ref": "EVENT_P3_008_FATE_BRANCH_SELECTION", "story_order_start": "P3-008", "story_order_end": null, "profile_canon_layer": "original_campaign", "role_in_event": "保护力量施加者", "character_specific_summary": "悠悠此前留下保护力量，为后续战斗提供保护。", "character_consequence": "保护效果在终战得到实际体现。", "revelation_refs": [], "evidence_refs": ["work/phase3d_r2/chronology/campaign_chronology.jsonl#EVENT_P3_008_FATE_BRANCH_SELECTION"], "reality_status": "ACTUAL_EVENT", "uncertainty": "confirmed", "notes": "持续时间未知。"},
    {"timeline_id": "TIMELINE_YOUYOU_FINAL_WAR", "event_ref": "EVENT_P3_009_DEATHWING_FINAL_WAR", "story_order_start": "P3-009", "story_order_end": null, "profile_canon_layer": "original_campaign", "role_in_event": "保护连续性的贡献者", "character_specific_summary": "她留下的保护力量使御临风在突袭中存活。", "character_consequence": "保护效果至少在本战有效。", "revelation_refs": [], "evidence_refs": ["work/phase3d_r2/chronology/campaign_chronology.jsonl#EVENT_P3_009_DEATHWING_FINAL_WAR"], "reality_status": "ACTUAL_EVENT", "uncertainty": "confirmed", "notes": "不推断 D3 仍然有效。"},
    {"timeline_id": "TIMELINE_YOUYOU_D3", "event_ref": "EVENT_TRANSITION_D3_CAMPAIGN_START", "story_order_start": "TRANSITION-D3", "story_order_end": null, "profile_canon_layer": "transition", "role_in_event": "时间锚点中的相关角色", "character_specific_summary": "D3 是续跑起点；不从历史推断悠悠当前感情或义务。", "character_consequence": "当前状态只接受 current_state 权威。", "revelation_refs": [], "evidence_refs": ["current_state.md:D3"], "reality_status": "ACTUAL_EVENT", "uncertainty": "confirmed", "notes": ""}
  ],
  "relationships": [], "ability_status_transitions": [], "knowledge_timeline": [], "nonactual_projections": [],
  "dynamic_state": {"as_of": "D3", "current_conditions": [], "current_obligations": [], "current_location_ref": null, "current_faction_role": null, "current_concerns": [], "source_refs": [], "notes": "D3 角色专属状态未确认。"},
  "presence": {"life_status": "alive", "narrative_availability": "normal", "canon_layers": ["original_campaign", "transition"], "source_refs": ["current_state.md:D3"], "uncertainty": "confirmed", "notes": "不推断当前婚约或爱情。"},
  "rp_constraints": [],
  "provenance": {"source_profile_candidate": "work/phase3d_recall/repaired_candidates/NPC_YOUYOU.json", "migration_package": "fixture:YOUYOU", "source_origin_ids": ["EVENT_P1_017_IMPERIAL_AUDIENCE_CURSE_EXAMINATION", "EVENT_P1_021_JERGAL_TRANSFER", "EVENT_P3_009_DEATHWING_FINAL_WAR", "EVENT_TRANSITION_D3_CAMPAIGN_START"], "generated_by": "scripts/build_phase3d_r2c.py"},
  "evidence_gaps": ["D3 感情、婚约和保护持续性未知。"], "notes": "R2C schema fixture only."
}
