{
  "schema_version": "2.0",
  "phase": "3D-R2C",
  "id": "NPC_WHITE_MAGICIAN",
  "profile_kind": "npc",
  "profile_status": "existing",
  "worldbook_id": "CHARACTER_WHITE_MAGICIAN",
  "worldbook_mapping_status": "existing",
  "name": "白色魔法使",
  "aliases": ["白魔", "笛木奏"],
  "profile_depth": "full",
  "canon_layers": ["original_campaign", "transition"],
  "control_mode": "npc_runtime",
  "ai_permissions": {
    "may_generate_dialogue": true,
    "may_choose_voluntary_actions": true,
    "may_generate_private_thoughts": true,
    "may_assign_new_goals": false,
    "may_describe_external_effects": true,
    "may_describe_involuntary_physical_reactions": true,
    "may_summarize_user_declared_actions": false,
    "may_reference_established_history": true
  },
  "identity": {"public_identity": [], "species_or_entity": [], "durable_roles": [], "durable_affiliations": []},
  "biographical_background": [
    {
      "background_id": "BACKGROUND_WHITE_MAGICIAN_PRISON_TOWER",
      "statement": "白色魔法使曾被帝国囚禁于监狱塔，并在魔兽之潮时期借沐透协助脱离。",
      "temporal_scope": "原 Campaign 开始前的历史",
      "relative_time": "早于 P1",
      "reality_status": "BIOGRAPHICAL_BACKGROUND",
      "evidence_mode": "explicit_source_statement",
      "attribution": "人物参考与原团陈述",
      "source_refs": ["work/phase3d_recall/repaired_candidates/NPC_WHITE_MAGICIAN.json"],
      "related_event_refs": [],
      "uncertainty": "confirmed",
      "notes": "监狱塔不是地下兵工厂。"
    }
  ],
  "persona": {"core_personality": [], "values": [], "speech_style": [], "decision_patterns": [], "motivations": []},
  "goals": {"historical_goals": [], "current_goals": [], "long_term_goals": [], "private_goals": []},
  "campaign_timeline": [
    {
      "timeline_id": "TIMELINE_WHITE_MAGICIAN_ARMORY",
      "event_ref": "EVENT_P2_023_WHITE_MAGICIAN_ARMORY_CONFRONTATION",
      "story_order_start": "P2-023",
      "story_order_end": null,
      "profile_canon_layer": "original_campaign",
      "role_in_event": "地下兵工厂交锋者",
      "character_specific_summary": "队伍在地下兵工厂与白色魔法使正面交锋。",
      "character_consequence": "形成已发生的直接敌对接触。",
      "revelation_refs": [],
      "evidence_refs": ["work/phase3d_r2/chronology/campaign_chronology.jsonl#EVENT_P2_023_WHITE_MAGICIAN_ARMORY_CONFRONTATION"],
      "reality_status": "ACTUAL_EVENT",
      "uncertainty": "confirmed",
      "notes": "地点与监狱塔不同。"
    },
    {
      "timeline_id": "TIMELINE_WHITE_MAGICIAN_SANCTUARY_FINALE",
      "event_ref": "EVENT_P3_010_WHITE_MAGE_EXIT_AND_THEORY",
      "story_order_start": "P3-010",
      "story_order_end": null,
      "profile_canon_layer": "original_campaign",
      "role_in_event": "秘境根基密室中的行动者与理论提出者",
      "character_specific_summary": "白魔压制本多与瑟坦特、取出魔宝石并提出命运与死亡之翼理论。",
      "character_consequence": "取得魔宝石；理论仍是理论。",
      "revelation_refs": [],
      "evidence_refs": ["work/phase3d_r2/chronology/campaign_chronology.jsonl#EVENT_P3_010_WHITE_MAGE_EXIT_AND_THEORY"],
      "reality_status": "ACTUAL_EVENT",
      "uncertainty": "confirmed",
      "notes": "不把理论升级为世界事实。"
    }
  ],
  "relationships": [],
  "ability_status_transitions": [],
  "knowledge_timeline": [],
  "nonactual_projections": [],
  "dynamic_state": {"as_of": "D3", "current_conditions": [], "current_obligations": [], "current_location_ref": null, "current_faction_role": null, "current_concerns": [], "source_refs": [], "notes": "D3 位置未知。"},
  "presence": {"life_status": "alive", "narrative_availability": "normal", "canon_layers": ["original_campaign", "transition"], "source_refs": ["current_state.md:D3"], "uncertainty": "confirmed", "notes": "不推断 D3 位置。"},
  "rp_constraints": [],
  "provenance": {"source_profile_candidate": "work/phase3d_recall/repaired_candidates/NPC_WHITE_MAGICIAN.json", "migration_package": "fixture:WHITE_MAGICIAN", "source_origin_ids": ["EVENT_P2_023_WHITE_MAGICIAN_ARMORY_CONFRONTATION", "EVENT_P3_010_WHITE_MAGE_EXIT_AND_THEORY"], "generated_by": "scripts/build_phase3d_r2c.py"},
  "evidence_gaps": ["完整控制机制与 D3 位置未知。"],
  "notes": "R2C schema fixture only."
}
