{
  "ability_status_transitions": [],
  "ai_permissions": {
    "may_assign_new_goals": false,
    "may_choose_voluntary_actions": true,
    "may_describe_external_effects": true,
    "may_describe_involuntary_physical_reactions": true,
    "may_generate_dialogue": true,
    "may_generate_private_thoughts": true,
    "may_reference_established_history": true,
    "may_summarize_user_declared_actions": false
  },
  "aliases": [],
  "biographical_background": [],
  "campaign_timeline": [
    {
      "character_consequence": "杨与御临风从互相戒备转为交换情报与有限合作，队伍给杨通讯卷轴。；队伍获得杨对边关弃子/诱饵的分析；该分析由杨明确称为猜测。；杨获知御临风关于异界神祇危机与龙族预言的有限信息。",
      "character_specific_summary": "间接但人物连续性关键：队伍遇到杨与哥布林；杨分析边关布置可能是弃子或诱饵。随后谢尔伦带队进入龙族宴会，五位龙王出场，元素龙王因事缺席。",
      "event_ref": "EVENT_P2_018_YANG_AND_DRAGON_BANQUET_ENTRY",
      "evidence_refs": [
        "extracted-second/NO.901MurginMunalos，我重临世界之日，诸逆臣皆当死去！ - 页 15/posts.jsonl post 959208",
        "extracted-second/NO.901MurginMunalos，我重临世界之日，诸逆臣皆当死去！ - 页 15/posts.jsonl post 959651",
        "extracted-second/NO.901MurginMunalos，我重临世界之日，诸逆臣皆当死去！ - 页 15/posts.jsonl post 959984",
        "extracted-second/NO.901MurginMunalos，我重临世界之日，诸逆臣皆当死去！ - 页 15/posts.jsonl post 960885",
        "extracted-second/NO.901MurginMunalos，我重临世界之日，诸逆臣皆当死去！ - 页 15/posts.jsonl post 962331"
      ],
      "notes": "Indirect continuity inclusion.",
      "profile_canon_layer": "original_campaign",
      "reality_status": "ACTUAL_EVENT",
      "revelation_refs": [],
      "role_in_event": "indirect continuity subject",
      "story_order_end": null,
      "story_order_start": "P2-018",
      "timeline_id": "TIMELINE_YANG_P2_018_YANG_AND_DRAGON_BANQUET_ENTRY",
      "uncertainty": "confirmed"
    }
  ],
  "canon_layers": [
    "original_campaign"
  ],
  "control_mode": "npc_runtime",
  "dynamic_state": {
    "as_of": "D3",
    "current_concerns": [],
    "current_conditions": [],
    "current_faction_role": null,
    "current_location_ref": null,
    "current_obligations": [],
    "notes": "没有以历史资料推断 D3 角色专属状态。",
    "source_refs": []
  },
  "evidence_gaps": [
    "未发现经直接确认的全名或其他别名。",
    "参谋职位及过往战绩目前按角色自述保存。",
    "与无名哥布林的关系只有杨称其为最好的朋友。"
  ],
  "goals": {
    "current_goals": [],
    "historical_goals": [],
    "long_term_goals": [],
    "private_goals": []
  },
  "id": "NPC_YANG",
  "identity": {
    "durable_affiliations": [],
    "durable_roles": [],
    "public_identity": [
      {
        "attribution": "杨自我介绍",
        "evidence_mode": "explicit_source_statement",
        "identity_id": "IDENTITY_YANG_NAME",
        "notes": "不扩写全名或别名。",
        "source_refs": [
          "extracted-second 第15页 #705：杨自我介绍与节点更新"
        ],
        "statement": "该角色自报名为杨。",
        "uncertainty": "confirmed"
      }
    ],
    "species_or_entity": [
      {
        "attribution": "原团观察",
        "evidence_mode": "explicit_source_statement",
        "identity_id": "IDENTITY_YANG_SLIME_FORM",
        "notes": "只保留观察到的形态。",
        "source_refs": [
          "extracted-second 第15页 #705：杨自我介绍与节点更新"
        ],
        "statement": "身高不到三十厘米、可流利交流的史莱姆",
        "uncertainty": "confirmed"
      }
    ]
  },
  "knowledge_timeline": [
    {
      "acquired_at_event_ref": "EVENT_P2_018_YANG_AND_DRAGON_BANQUET_ENTRY",
      "acquired_at_story_order": "P2-018",
      "attribution": "杨自述",
      "epistemic_status": "TESTIMONY_HEARD",
      "knowledge_id": "KNOWLEDGE_YANG_SELF_REPORTED_ROLE",
      "notes": "职位与经历未被独立确认。",
      "proposition": "魔兽联合驻边境关卡的参谋之一",
      "reality_status": "TESTIMONY",
      "source_character_ref": "NPC_YANG",
      "source_refs": [
        "extracted-second 第15页 #711：杨说明参谋身份与不死者经历"
      ],
      "supersedes": [],
      "uncertainty": "character_belief",
      "valid_from": "P2-018",
      "valid_until": null
    }
  ],
  "name": "杨",
  "nonactual_projections": [],
  "notes": "R2A-confirmed Canon discovery; still unapproved and unapplied.",
  "persona": {
    "core_personality": [],
    "decision_patterns": [],
    "motivations": [],
    "speech_style": [],
    "values": []
  },
  "phase": "3D-R2C",
  "presence": {
    "canon_layers": [
      "original_campaign"
    ],
    "life_status": "alive",
    "narrative_availability": "inactive",
    "notes": "分别后的当前状态未知。",
    "source_refs": [
      "extracted-second 第15页 #705：杨自我介绍与节点更新"
    ],
    "uncertainty": "confirmed"
  },
  "profile_depth": "minimal",
  "profile_kind": "npc",
  "profile_status": "provisional_discovery",
  "provenance": {
    "generated_by": "scripts/build_phase3d_r2c.py",
    "migration_package": "work/phase3d_r2c/migration_packages/NPC_YANG.json",
    "source_origin_ids": [
      "none:new provisional discovery",
      "work/phase3d_r2b/indexes/by_profile/NPC_YANG.json",
      "work/phase3d_r2/chronology/campaign_chronology.jsonl",
      "work/phase3d_r2/chronology/character_revelations.jsonl",
      "work/phase3d_r2/event_audits/",
      "work/phase3d_r2/reports/early_arc_character_retention.md",
      "work/phase3d_r2/character_discoveries/",
      "current_state.md:D3",
      "output/worldbook_source.jsonl"
    ],
    "source_profile_candidate": null
  },
  "relationships": [],
  "rp_constraints": [
    {
      "constraint_id": "CONSTRAINT_YANG_IDENTITY_TRIGGER_SEPARATION",
      "notes": "Canon/runtime 解耦。",
      "source_refs": [
        "work/phase3d_r2/character_discoveries/CHARACTER_YANG.json"
      ],
      "statement": "单字名的触发歧义不得否决 Canon 身份，也不得在 R2C 创建运行时触发词。"
    }
  ],
  "schema_version": "2.0",
  "worldbook_id": null,
  "worldbook_mapping_status": "provisional_unmapped"
}
