{
  "schema_version": "2.0", "phase": "3D-R2C", "id": "NPC_OSHIRA", "profile_kind": "npc",
  "profile_status": "existing", "worldbook_id": "CHARACTER_OSHIRA", "worldbook_mapping_status": "existing",
  "name": "奥希拉", "aliases": [], "profile_depth": "full", "canon_layers": ["original_campaign"],
  "control_mode": "npc_runtime",
  "ai_permissions": {"may_generate_dialogue": true, "may_choose_voluntary_actions": true, "may_generate_private_thoughts": true, "may_assign_new_goals": false, "may_describe_external_effects": true, "may_describe_involuntary_physical_reactions": true, "may_summarize_user_declared_actions": false, "may_reference_established_history": true},
  "identity": {"public_identity": [], "species_or_entity": [], "durable_roles": [], "durable_affiliations": []},
  "biographical_background": [],
  "persona": {"core_personality": [], "values": [], "speech_style": [], "decision_patterns": [], "motivations": []},
  "goals": {"historical_goals": [], "current_goals": [], "long_term_goals": [], "private_goals": []},
  "campaign_timeline": [], "relationships": [],
  "ability_status_transitions": [
    {"transition_id": "TRANSITION_OSHIRA_NONVOLUNTARY_CONTROL", "event_ref": "EVENT_P3_003_TEIRESIAS_REVELATION", "background_ref": null, "story_order": "P3-003", "transition_type": "control", "before_state": "黑龙族长的自主状态", "after_state": "受到白魔控制并执行行动", "persistence": "unknown", "reality_status": "ACTUAL_EVENT", "evidence_mode": "explicit_source_statement", "attribution": "泰蕾斯/悠悠预见及后续事件支持的非自愿控制", "source_refs": ["work/phase3d_r2/chronology/campaign_chronology.jsonl#EVENT_P3_003_TEIRESIAS_REVELATION"], "uncertainty": "uncertain", "notes": "控制机制、意识状态未知，控制是否持续及后续记忆未知。"}
  ],
  "knowledge_timeline": [
    {"knowledge_id": "KNOWLEDGE_OSHIRA_LINEAGE_TESTIMONY", "proposition": "奥希拉曾讲述黑龙族与死亡之翼的历史。", "epistemic_status": "TESTIMONY_HEARD", "acquired_at_event_ref": "EVENT_P2_022_DEATHWING_HISTORY_TESTIMONY", "acquired_at_story_order": "P2-022", "source_character_ref": "NPC_OSHIRA", "attribution": "奥希拉本人 testimony", "supersedes": [], "valid_from": "P2-022", "valid_until": null, "reality_status": "TESTIMONY", "source_refs": ["work/phase3d_r2/chronology/campaign_chronology.jsonl#EVENT_P2_022_DEATHWING_HISTORY_TESTIMONY"], "uncertainty": "character_belief", "notes": "与受控状态分离。"}
  ],
  "nonactual_projections": [],
  "dynamic_state": {"as_of": "D3", "current_conditions": [], "current_obligations": [], "current_location_ref": null, "current_faction_role": null, "current_concerns": [], "source_refs": [], "notes": "D3 持续影响未知。"},
  "presence": {"life_status": "alive", "narrative_availability": "restricted", "canon_layers": ["original_campaign"], "source_refs": ["work/phase3d_r2/chronology/campaign_chronology.jsonl#EVENT_P2_022_DEATHWING_HISTORY_TESTIMONY"], "uncertainty": "uncertain", "notes": "不推断控制后的完整状态。"},
  "rp_constraints": [],
  "provenance": {"source_profile_candidate": "work/phase3d_recall/repaired_candidates/NPC_OSHIRA.json", "migration_package": "fixture:OSHIRA", "source_origin_ids": ["EVENT_P2_022_DEATHWING_HISTORY_TESTIMONY", "EVENT_P3_003_TEIRESIAS_REVELATION"], "generated_by": "scripts/build_phase3d_r2c.py"},
  "evidence_gaps": ["控制机制、意识、记忆与持续性未知。"], "notes": "R2C schema fixture only."
}
